result,result1,result2,result3
迎える（むかえる）," to go out to meet, to welcome, to greet",誕生日を迎えます , I will have my birthday
向かう（むかう）," to go towards, to head towards",私はその駅に向かう , I am going to head to that station
昔（むかし）, olden days,この町は昔のままだ , This town is the same as old days
虫（むし）," insect, bug",虫をつかまえる , Catch an insect
息子（むすこ）, son,息子さんはお元気ですか , How is your son?
娘（むすめ）, daughter,娘は9歳です , My daughter is 9 years old
無理（むり）," unreasonable, impossible",それは無理です , That’s impossible
召し上がる（めしあがる）," to eat, to drink",食べ物を召し上がる , Eat food
珍しい（めずらしい）, rare,この本は珍しいです , This book is rare
申し上げる（もうしあげる）," to say, to tell, to state, to express, to offer",意見を申し上げる , Express an opinion
申す（もうす）," to say, to be called",私は田中と申します , My name is Tanaka
もうすぐ ," soon, almost, nearly",もうすぐ春が来ます , Spring is coming soon
もし ," if, in case, supposing",もし私がお金持ちだったら、たくさんの車を買います ," If I am rich, I will buy lots of cars"
もちろん ," of course, certainly",もちろん覚えているよ , Of course I remember
もっとも ," most, extremely",もっとも正しい答え , The most correct answer
戻る（もどる）," to return, to go back",すぐに戻るよ , I’ll be back soon
もめん , cotton (material),もめんのシャツを着る , Wear a cotton shirt
もらう ," to receive, to take, to accept",プレゼントをもらう , Receive a present
森（もり）, forest,森を育てる , Grow a forest
焼く（やく）," to burn, to roast, to grill",魚を焼く , Grill a fish
役に立つ（やくにたつ）," to be helpful, to be useful",この本は高いが役に立ちます , This book is expensive but helpful
約束（やくそく）, promise,約束を守る , Keep a promise
焼ける（やける）," to burn, to be roasted, to be heated",魚が焼ける , Fish broils
優しい（やさしい）," kind, gentle",彼は優しいです , He is kind
やせる ," to become thin, to lose weight",あなたはやせていますね , You are losing weight
やっと , at last,やっとわかった , Finally I understand it.
やはり/やっぱり ," still, as before, as expected",それは、やはり無理ですね ," As I thought, that is impossible"
止む（やむ）," to cease, to stop",雨が止む , The rain stops
止める（やめる）, to stop,出血を止める , Stop the bleeding
柔らかい（やわらかい）, soft,赤ちゃんの手は柔らかい , The baby’s hands are soft
湯（ゆ）, hot water,お湯が出ません , There’s no hot water
夕飯（ゆうはん）, evening meal,夕飯を食べましたか , Did you have dinner?
輸出・する（ゆしゅつ・する）, export,日本車はアメリカに輸出される , Japanese cars are exported to the United States
輸入・する（ゆにゅう・する）, import,海外から輸入する , To import from abroad
指（ゆび）," finger, toe",指を指す , To point one’s finger at
指輪（ゆびわ）, ring (finger),彼は私に指輪をくれた , He gave me a ring
夢（ゆめ）, dream,夢を追う , I chase my dreams
揺れる（ゆれる）, to shake,地震で建物が揺れる , The buildings shake because of the earthquake
用（よう）," business, errand, engagement",用がある , I am engaged
用意（ようい）," preparation, arrangements, getting ready",夕食の用意をする , Get dinner ready
用事（ようじ）," tasks, things to do, errand, business ",その日は用事がある , I have plans on this day
汚れる（よごれる）," to get dirty, to become dirty",私の服は汚れました , My clothes got dirty
予習（よしゅう）, preparation for a lesson,私は予習しています , I am preparing for a lesson
予定（よてい）," plans, schedule",どこに行く予定ですか , Where are you going to go?
予約（よやく）, reservation,彼女がホテルを予約する , She books the hotel
寄る（よる）," to stop by, to drop by",そのお店に寄る , I will drop by that store
（～に）よると , according to,天気予報によると、明日は雨が降るそうです ," According to the weather forecast, it will rain tomorrow"
喜ぶ（よろこぶ）," to be delighted, to be glad, to be pleased",彼女は喜ぶ , She is happy
よろしい ," good, OK, all right, may, can",どこに行けばよろしいでしょうか , Where should I go?
理由（りゆう）, reason,理由は知らない , I don’t know the reason
利用（りよう）, use,機会を利用する , Embrace an opportunity
両方（りょうほう）," both, both sides",私の目は両方とも 1.0 まで見える , My eyesight in both eyes is 1.0
旅館（りょかん）," traditional inn, Japanese-style lodging",私はその旅館に泊まりました , I stayed at that Japanese inn
るす ," absence, being away from home",母はるすです , Mother is not at home
冷房（れいぼう）," cooling, air-conditioning",その部屋は冷房がついていますか , Does that room have air conditioning?
歴史（れきし）, history,歴史を勉強する , Study history
レジ , (cash) register,,
レポート/リポート , report,レポートを書く , Write a report
連絡（れんらく）," contacting, getting in touch, call",いつでもご連絡ください , Please contact me anytime
ワープロ , word processor,ワープロで手紙を書く , Write a letter on a word processor
わかす , to boil,湯を沸かす , Boil water
別れる（わかれる）," to separate (of a couple), to break up, to divorce",私と彼は別れるかもしれません , He and I might break up
わく ," to boil, to grow hot",私はお湯が沸くのを待っています , I’m waiting for the water to boil
わけ ," reason, cause, meaning",わけを聞く , Inquire the reason
忘れ物（わすれもの）," lost article, something forgotten",私は忘れ物を取りに行きます , I will go to get the things I forgot
笑う（わらう）," to laugh, to smile",彼は私のことを笑う , He laughs at me
割合（わりあい）," rate, ratio, proportion",作り方は粉 2 に砂糖 1 の割合にします , The recipe uses 2 parts flour to 1 part sugar
割れる（われる）," to break, to be smashed",窓が割れる , The window breaks
泳ぎ方（およぎかた）, way of swimming,彼は私に泳ぎ方を教えてくれた , He taught me how to swim
